{
  "id": "show-and-compare-numbers",
  "title": "Show and compare numbers",
  "summary": "Use pictures and number lines to compare numbers.",
  "subject": "maths",
  "type": "counting",
  "yearGroups": [
    "Year1"
  ],
  "ability": "emerging",
  "estimatedMinutes": 5,
  "masteryThreshold": 0.8,
  "curriculumRef": "y1-represent-100",
  "pathNode": "y1-represent-100",
  "difficulty": 1,
  "questionCount": 10,
  "difficultyRamp": {
    "within": "Start with quantities shown as apples, compare fewer and equal groups, identify two marked number-line positions, then compare more, less, most and least before ordering four numbers.",
    "versus": "Easy uses pictures to 8 and numerals in the teens. Medium uses pictures to 14 and numerals around 40 to 60. Hard uses pictures to 20 and closely spaced numerals around 90 to 100. All levels use the same representations with progressively larger quantities."
  },
  "skills": [
    "represent-numbers",
    "number-lines",
    "compare-quantities"
  ],
  "questions": [
    {
      "kind": "multiple-choice",
      "prompt": "How many apples can you see?",
      "options": [
        {
          "id": "0",
          "label": "5"
        },
        {
          "id": "1",
          "label": "6"
        },
        {
          "id": "2",
          "label": "7"
        },
        {
          "id": "3",
          "label": "8"
        }
      ],
      "correctId": "1",
      "explanation": "There are 6 apples.",
      "randomise": {
        "shuffleOptions": true
      },
      "visual": {
        "item": "apple",
        "count": 6
      },
      "layout": "row",
      "id": "represent100-1-1",
      "hint": "Count each apple once."
    },
    {
      "kind": "multiple-choice",
      "prompt": "Which group has fewer than 6 apples?",
      "options": [
        {
          "id": "0",
          "visual": {
            "item": "apple",
            "count": 4
          }
        },
        {
          "id": "1",
          "visual": {
            "item": "apple",
            "count": 6
          }
        },
        {
          "id": "2",
          "visual": {
            "item": "apple",
            "count": 7
          }
        },
        {
          "id": "3",
          "visual": {
            "item": "apple",
            "count": 8
          }
        }
      ],
      "correctId": "0",
      "explanation": "4 is less than 6.",
      "randomise": {
        "shuffleOptions": true
      },
      "id": "represent100-1-2",
      "hint": "Compare how many apples are in each group."
    },
    {
      "kind": "match-pairs",
      "prompt": "Match each group to an equal number of apples.",
      "pairs": [
        {
          "id": "0",
          "left": {
            "visual": {
              "item": "apple",
              "count": 3
            }
          },
          "right": {
            "visual": {
              "item": "apple",
              "count": 3
            }
          }
        },
        {
          "id": "1",
          "left": {
            "visual": {
              "item": "apple",
              "count": 5
            }
          },
          "right": {
            "visual": {
              "item": "apple",
              "count": 5
            }
          }
        },
        {
          "id": "2",
          "left": {
            "visual": {
              "item": "apple",
              "count": 6
            }
          },
          "right": {
            "visual": {
              "item": "apple",
              "count": 6
            }
          }
        }
      ],
      "explanation": "Equal groups have the same number of apples.",
      "id": "represent100-1-3",
      "hint": "Find groups with the same number of apples."
    },
    {
      "kind": "multiple-choice",
      "prompt": "Which number belongs at the marked tick?",
      "options": [
        {
          "id": "0",
          "label": "11"
        },
        {
          "id": "1",
          "label": "12"
        },
        {
          "id": "2",
          "label": "13"
        },
        {
          "id": "3",
          "label": "14"
        }
      ],
      "correctId": "1",
      "explanation": "The marked tick is 12. Each tick is one more than the tick before it.",
      "randomise": {
        "shuffleOptions": true
      },
      "numberLine": {
        "start": 10,
        "end": 16,
        "marked": 12
      },
      "id": "represent100-1-4"
    },
    {
      "kind": "multiple-choice",
      "prompt": "Which number belongs at the marked tick?",
      "options": [
        {
          "id": "0",
          "label": "14"
        },
        {
          "id": "1",
          "label": "15"
        },
        {
          "id": "2",
          "label": "16"
        },
        {
          "id": "3",
          "label": "17"
        }
      ],
      "correctId": "1",
      "explanation": "The marked tick is 15. Each tick is one more than the tick before it.",
      "randomise": {
        "shuffleOptions": true
      },
      "numberLine": {
        "start": 10,
        "end": 16,
        "marked": 15
      },
      "id": "represent100-1-5"
    },
    {
      "kind": "multi-select",
      "prompt": "Select the two numbers that are more than 16.",
      "options": [
        {
          "id": "0",
          "label": "17"
        },
        {
          "id": "1",
          "label": "15"
        },
        {
          "id": "2",
          "label": "18"
        },
        {
          "id": "3",
          "label": "16"
        }
      ],
      "explanation": "17 and 18 are both more than 16.",
      "randomise": {
        "shuffleOptions": true
      },
      "id": "represent100-1-6",
      "correctIds": [
        "0",
        "2"
      ]
    },
    {
      "kind": "multiple-choice",
      "prompt": "Which number is less than 16?",
      "options": [
        {
          "id": "0",
          "label": "18"
        },
        {
          "id": "1",
          "label": "16"
        },
        {
          "id": "2",
          "label": "15"
        },
        {
          "id": "3",
          "label": "17"
        }
      ],
      "correctId": "2",
      "explanation": "15 is less than 16.",
      "randomise": {
        "shuffleOptions": true
      },
      "id": "represent100-1-7"
    },
    {
      "kind": "multiple-choice",
      "prompt": "Which number is the most?",
      "options": [
        {
          "id": "0",
          "label": "13"
        },
        {
          "id": "1",
          "label": "16"
        },
        {
          "id": "2",
          "label": "18"
        },
        {
          "id": "3",
          "label": "15"
        }
      ],
      "correctId": "2",
      "explanation": "18 is the biggest number in this group.",
      "randomise": {
        "shuffleOptions": true
      },
      "id": "represent100-1-8"
    },
    {
      "kind": "multiple-choice",
      "prompt": "Which number is the least?",
      "options": [
        {
          "id": "0",
          "label": "18"
        },
        {
          "id": "1",
          "label": "14"
        },
        {
          "id": "2",
          "label": "16"
        },
        {
          "id": "3",
          "label": "17"
        }
      ],
      "correctId": "1",
      "explanation": "14 is the smallest number in this group.",
      "randomise": {
        "shuffleOptions": true
      },
      "id": "represent100-1-9"
    },
    {
      "kind": "ordered",
      "prompt": "Put the numbers in order, from smallest to biggest.",
      "items": [
        {
          "id": "2",
          "label": "16"
        },
        {
          "id": "0",
          "label": "13"
        },
        {
          "id": "3",
          "label": "19"
        },
        {
          "id": "1",
          "label": "15"
        }
      ],
      "correctOrder": [
        "0",
        "1",
        "2",
        "3"
      ],
      "explanation": "The numbers go 13, 15, 16, 19.",
      "id": "represent100-1-10"
    }
  ]
}
