{
  "id": "count-in-2s-5s-10s-medium",
  "title": "Count in 2s, 5s and 10s",
  "summary": "Count in fives, twos and tens. Continue a count, find a missing number and count groups.",
  "subject": "maths",
  "type": "counting",
  "yearGroups": [
    "Year1"
  ],
  "ability": "expected",
  "estimatedMinutes": 6,
  "masteryThreshold": 0.8,
  "curriculumRef": "y1-count-2-5-10",
  "pathNode": "y1-count-2-5-10",
  "difficulty": 2,
  "questionCount": 10,
  "difficultyRamp": {
    "within": "Q1 counts 15 blocks in fives. Child thinks 5, 10, 15. Q2 continues 20, 25, 30. Q3 finds 16 in a twos gap. Q4 counts groups of 5 in 20 blocks. Q5 fills 45 on a hundred square counting in fives. Q6 counts hops of 5 to the mark at 15. Q7 matches 10 to two groups of 5 on a ten frame. Q8 picks two tens-count numbers. Q9 counts 3 children holding up one hand each. Q10 orders 35, 40, 45, 50.",
    "versus": "Easy uses pairs and tens pictures up to 50, with hops on the number line. Medium adds fives, a twos gap, a tens pick and higher 5s counts. Hard names the step size, counts back, spots a number you would not say, and orders from biggest to smallest. Hard is a new kind of thinking, not just bigger numbers."
  },
  "skills": [
    "count-in-2s",
    "count-in-5s",
    "count-in-10s"
  ],
  "questions": [
    {
      "id": "c2510-2-1",
      "kind": "multiple-choice",
      "prompt": "How many blocks can you see?",
      "tenFrame": {
        "count": 15,
        "item": "star"
      },
      "options": [
        {
          "id": "a",
          "label": "5"
        },
        {
          "id": "b",
          "label": "10"
        },
        {
          "id": "c",
          "label": "14"
        },
        {
          "id": "d",
          "label": "15"
        }
      ],
      "correctId": "d",
      "explanation": "There are 15 blocks. They go 5, 10, 15. Not 14 or 10.",
      "narration": {
        "prompt": "How many blocks can you see?"
      },
      "randomise": {
        "shuffleOptions": true
      }
    },
    {
      "id": "c2510-2-2",
      "kind": "fill-blank",
      "prompt": "What number comes next? 20, 25, 30, ?",
      "explanation": "After 30 comes 35. Add 5 each time. Not 31.",
      "narration": {
        "prompt": "What number comes next? Twenty, twenty-five, thirty, blank."
      },
      "acceptedAnswers": [
        "35",
        "thirty-five",
        "thirty five"
      ],
      "inputMode": "numeric",
      "numericChoices": [
        31,
        32,
        35,
        40
      ]
    },
    {
      "id": "c2510-2-3",
      "kind": "multiple-choice",
      "prompt": "Which number is missing?",
      "numberSequence": [
        12,
        14,
        null,
        18
      ],
      "options": [
        {
          "id": "a",
          "label": "16"
        },
        {
          "id": "b",
          "label": "17"
        },
        {
          "id": "c",
          "label": "18"
        },
        {
          "id": "d",
          "label": "20"
        }
      ],
      "correctId": "a",
      "explanation": "16 sits between 14 and 18. The jump is 2, not 1.",
      "narration": {
        "prompt": "Which number is missing? Twelve, fourteen, blank, eighteen."
      },
      "randomise": {
        "shuffleOptions": true
      }
    },
    {
      "id": "c2510-2-4",
      "kind": "fill-blank",
      "prompt": "How many groups of 5 blocks can you see?",
      "tenFrame": {
        "count": 20,
        "item": "star"
      },
      "explanation": "20 blocks make 4 groups of 5. Not 20 ones.",
      "narration": {
        "prompt": "How many groups of 5 blocks can you see?"
      },
      "acceptedAnswers": [
        "4",
        "four"
      ],
      "inputMode": "numeric",
      "numericChoices": [
        2,
        4,
        5,
        20
      ]
    },
    {
      "id": "c2510-2-5",
      "kind": "multiple-choice",
      "prompt": "Count in fives. Which number goes in the empty cell?",
      "hundredSquare": {
        "start": 31,
        "rows": 3,
        "missing": 45,
        "highlight": 40
      },
      "options": [
        {
          "id": "a",
          "label": "35"
        },
        {
          "id": "b",
          "label": "40"
        },
        {
          "id": "c",
          "label": "44"
        },
        {
          "id": "d",
          "label": "45"
        }
      ],
      "correctId": "d",
      "explanation": "The empty cell is 45. Fives go 35, 40, 45, 50.",
      "narration": {
        "prompt": "Count in fives. Which number goes in the empty cell?"
      },
      "randomise": {
        "shuffleOptions": true
      }
    },
    {
      "id": "c2510-2-6",
      "kind": "multiple-choice",
      "prompt": "Count in fives from 0. Which number sits on the mark?",
      "numberLine": {
        "start": 0,
        "end": 20,
        "scale": "ones",
        "marked": 15,
        "jumps": {
          "step": 5,
          "from": 0
        }
      },
      "options": [
        {
          "id": "a",
          "label": "10"
        },
        {
          "id": "b",
          "label": "14"
        },
        {
          "id": "c",
          "label": "15"
        },
        {
          "id": "d",
          "label": "20"
        }
      ],
      "correctId": "c",
      "explanation": "The mark is 15. The hops go 5, 10, 15 from 0.",
      "narration": {
        "prompt": "Count in fives from 0. Which number sits on the mark?"
      },
      "randomise": {
        "shuffleOptions": true
      }
    },
    {
      "id": "c2510-2-7",
      "kind": "match-pairs",
      "prompt": "Select the card that matches the number.",
      "mode": "one-at-a-time",
      "pairs": [
        {
          "id": "p1",
          "left": "10",
          "right": {
            "tenFrame": {
              "count": 10,
              "item": "star",
              "parts": [5, 5]
            }
          }
        }
      ],
      "choices": [
        {
          "tenFrame": {
            "count": 10,
            "item": "star",
            "parts": [5, 5]
          }
        },
        {
          "tenFrame": {
            "count": 5,
            "item": "star"
          }
        },
        {
          "tenFrame": {
            "count": 8,
            "item": "star"
          }
        }
      ],
      "explanation": "10 is two groups of 5. Not 5 or 8.",
      "narration": {
        "prompt": "Select the card that matches the number."
      }
    },
    {
      "id": "c2510-2-8",
      "kind": "multi-select",
      "prompt": "Tap the two numbers you say when you count in tens.",
      "options": [
        {
          "id": "a",
          "label": "40"
        },
        {
          "id": "b",
          "label": "41"
        },
        {
          "id": "c",
          "label": "45"
        },
        {
          "id": "d",
          "label": "50"
        }
      ],
      "correctIds": [
        "a",
        "d"
      ],
      "explanation": "You say 40 and 50. 41 and 45 are not tens.",
      "narration": {
        "prompt": "Tap the two numbers you say when you count in tens."
      },
      "randomise": {
        "shuffleOptions": true
      }
    },
    {
      "id": "c2510-2-9",
      "kind": "fill-blank",
      "prompt": "Three children each hold up one hand. How many fingers is that?",
      "explanation": "3 hands make 15 fingers. They go 5, 10, 15. Not 3.",
      "narration": {
        "prompt": "Three children each hold up one hand. How many fingers is that?"
      },
      "acceptedAnswers": [
        "15",
        "fifteen"
      ],
      "inputMode": "numeric",
      "numericChoices": [
        3,
        8,
        15,
        30
      ]
    },
    {
      "id": "c2510-2-10",
      "kind": "ordered",
      "prompt": "Put the numbers in order, from smallest to biggest.",
      "items": [
        {
          "id": "n45",
          "label": "45"
        },
        {
          "id": "n35",
          "label": "35"
        },
        {
          "id": "n50",
          "label": "50"
        },
        {
          "id": "n40",
          "label": "40"
        }
      ],
      "correctOrder": [
        "n35",
        "n40",
        "n45",
        "n50"
      ],
      "explanation": "The numbers go 35, 40, 45, 50. Each jump is 5.",
      "narration": {
        "prompt": "Put the numbers in order, from smallest to biggest."
      }
    }
  ]
}
