{
  "id": "count-beyond-20",
  "title": "Count beyond 20",
  "summary": "Count on and back across 20 with a hundred square and a number line.",
  "subject": "maths",
  "type": "counting",
  "yearGroups": [
    "Reception"
  ],
  "ability": "emerging",
  "estimatedMinutes": 5,
  "masteryThreshold": 0.8,
  "curriculumRef": "eyfs-count-20plus",
  "pathNode": "eyfs-count-20plus",
  "difficulty": 1,
  "questionCount": 10,
  "difficultyRamp": {
    "within": "Q1 to Q3 read a 3-row square, then cross 20 both ways. Q4 and Q5 go after 19 and before 21. Q6 spots a count that repeats. Q7 reads 20 on a 0 to 20 line. Q8 types the number after 20. Q9 spots 10 and a bit. Q10 orders 19 to 22.",
    "versus": "Easy uses a 3-row square and a 0 to 20 line around 20. Medium moves the window higher and counts both ways. Hard adds tens and ones, reverse thinking and counts towards 30."
  },
  "skills": [
    "eyfs-count-20plus",
    "count-beyond-20",
    "teen-number-pattern"
  ],
  "questions": [
    {
      "id": "c20-1-1",
      "kind": "fill-blank",
      "prompt": "Which number goes in the empty cell?",
      "hundredSquare": {
        "start": 11,
        "rows": 3,
        "missing": 16
      },
      "hint": "Read along the row.",
      "explanation": "The empty cell is 16. After 15 comes 16, not a ten jump.",
      "narration": {
        "prompt": "Which number goes in the empty cell?"
      },
      "acceptedAnswers": [
        "16",
        "sixteen"
      ],
      "inputMode": "numeric"
    },
    {
      "id": "c20-1-2",
      "kind": "multiple-choice",
      "prompt": "Which number is under 15?",
      "hundredSquare": {
        "start": 11,
        "rows": 3,
        "missing": 25,
        "highlight": 15
      },
      "options": [
        {
          "id": "a",
          "label": "14"
        },
        {
          "id": "b",
          "label": "16"
        },
        {
          "id": "c",
          "label": "25"
        }
      ],
      "correctId": "c",
      "hint": "Under means ten more.",
      "explanation": "Under 15 is 25. That is ten more, not one more.",
      "narration": {
        "prompt": "Which number is under 15?"
      },
      "randomise": {
        "shuffleOptions": true
      }
    },
    {
      "id": "c20-1-3",
      "kind": "multiple-choice",
      "prompt": "Which number is left of 22?",
      "hundredSquare": {
        "start": 11,
        "rows": 3,
        "missing": 21,
        "highlight": 22
      },
      "options": [
        {
          "id": "a",
          "label": "22"
        },
        {
          "id": "b",
          "label": "21"
        },
        {
          "id": "c",
          "label": "23"
        }
      ],
      "correctId": "b",
      "hint": "Left is one less.",
      "explanation": "21 is one less than 22, so it sits just to the left.",
      "narration": {
        "prompt": "Which number is left of 22?"
      },
      "randomise": {
        "shuffleOptions": true
      }
    },
    {
      "id": "c20-1-4",
      "kind": "fill-blank",
      "prompt": "What number comes after 19?",
      "explanation": "After 19 comes 20. The ones go back to 0.",
      "narration": {
        "prompt": "What number comes after 19?"
      },
      "acceptedAnswers": [
        "20",
        "twenty"
      ],
      "inputMode": "numeric"
    },
    {
      "id": "c20-1-5",
      "kind": "fill-blank",
      "prompt": "What number comes before 21?",
      "explanation": "Before 21 is 20. Do not jump back a whole ten.",
      "narration": {
        "prompt": "What number comes before 21?"
      },
      "acceptedAnswers": [
        "20",
        "twenty"
      ],
      "inputMode": "numeric"
    },
    {
      "id": "c20-1-6",
      "kind": "multiple-choice",
      "prompt": "Which number is wrong?",
      "options": [
        {
          "id": "a",
          "label": "17"
        },
        {
          "id": "b",
          "label": "23"
        },
        {
          "id": "c",
          "label": "22"
        }
      ],
      "correctId": "b",
      "explanation": "The run jumps. After 21 comes 22.",
      "narration": {
        "prompt": "Which number is wrong? 18, 19, 20, 21, 23."
      },
      "randomise": {
        "shuffleOptions": true
      },
      "numberSequence": [
        18,
        19,
        20,
        21,
        23
      ]
    },
    {
      "id": "c20-1-7",
      "kind": "multiple-choice",
      "prompt": "Which number sits on the mark?",
      "numberLine": {
        "start": 0,
        "end": 20,
        "scale": "ones",
        "marked": 20
      },
      "options": [
        {
          "id": "a",
          "label": "2"
        },
        {
          "id": "b",
          "label": "19"
        },
        {
          "id": "c",
          "label": "20"
        }
      ],
      "correctId": "c",
      "explanation": "The last tick is 20. That is 2 tens, not 2.",
      "narration": {
        "prompt": "Which number sits on the mark?"
      },
      "randomise": {
        "shuffleOptions": true
      }
    },
    {
      "id": "c20-1-8",
      "kind": "fill-blank",
      "prompt": "Type the number after 20.",
      "acceptedAnswers": [
        "21",
        "twenty-one",
        "twenty one"
      ],
      "inputMode": "numeric",
      "explanation": "After 20 comes 21. The ones start again at 1.",
      "narration": {
        "prompt": "Type the number after 20."
      }
    },
    {
      "id": "c20-1-9",
      "kind": "multiple-choice",
      "prompt": "13 is 10 and how many more?",
      "options": [
        {
          "id": "a",
          "label": "1"
        },
        {
          "id": "b",
          "label": "3"
        },
        {
          "id": "c",
          "label": "4"
        }
      ],
      "correctId": "b",
      "explanation": "13 is 10 and 3. The 1 is the ten, not the extra.",
      "narration": {
        "prompt": "13 is 10 and how many more?"
      },
      "randomise": {
        "shuffleOptions": true
      }
    },
    {
      "id": "c20-1-10",
      "kind": "ordered",
      "prompt": "Put the numbers in order, from smallest to biggest.",
      "items": [
        {
          "id": "n21",
          "label": "21"
        },
        {
          "id": "n19",
          "label": "19"
        },
        {
          "id": "n20",
          "label": "20"
        },
        {
          "id": "n22",
          "label": "22"
        }
      ],
      "correctOrder": [
        "n19",
        "n20",
        "n21",
        "n22"
      ],
      "explanation": "The numbers go 19, 20, 21, 22 across 20.",
      "narration": {
        "prompt": "Put the numbers in order, from smallest to biggest."
      }
    }
  ]
}
