{
  "id": "whole-half-quarter-turns",
  "title": "Whole, half and quarter turns",
  "summary": "Use position words and explore full, half and quarter turns.",
  "subject": "maths",
  "type": "reasoning",
  "yearGroups": [
    "Year1"
  ],
  "ability": "emerging",
  "estimatedMinutes": 6,
  "masteryThreshold": 0.8,
  "curriculumRef": "y1-turns",
  "pathNode": "y1-turns",
  "difficulty": 1,
  "questionCount": 10,
  "difficultyRamp": {
    "within": "Q1 to Q2 read illustrated position scenes, including left. Q3 to Q5 watch how much the car turns. Q6 to Q9 predict the end facing from a clock-hand cue. Q10 performs a quarter turn this way.",
    "versus": "Easy uses position words, whole and half turns, supported quarter turns and one performed quarter turn. Medium varies starts and uses the clock-hand cue for both ways. Hard adds three-quarter turns and four performed turns. Hard is a new kind of thinking, not only a bigger turn."
  },
  "skills": [
    "y1-turns",
    "position-words",
    "turn-direction",
    "amount-of-turn"
  ],
  "questions": [
    {
      "id": "turns-1-1",
      "kind": "multiple-choice",
      "prompt": "Where is the tree?",
      "options": [
        {
          "id": "a",
          "label": "Behind Pip"
        },
        {
          "id": "b",
          "label": "In front of Pip"
        },
        {
          "id": "c",
          "label": "Above Pip"
        },
        {
          "id": "d",
          "label": "To the left of Pip"
        }
      ],
      "correctId": "a",
      "explanation": "The tree is behind Pip, not to the left.",
      "narration": {
        "prompt": "Where is the tree?"
      },
      "randomise": {
        "shuffleOptions": true
      },
      "position": {
        "object": "tree",
        "relation": "behind"
      }
    },
    {
      "id": "turns-1-2",
      "kind": "multiple-choice",
      "prompt": "Where is the bird?",
      "options": [
        {
          "id": "a",
          "label": "Above Pip"
        },
        {
          "id": "b",
          "label": "Behind Pip"
        },
        {
          "id": "c",
          "label": "In front of Pip"
        },
        {
          "id": "d",
          "label": "To the right of Pip"
        }
      ],
      "correctId": "a",
      "explanation": "The bird is above Pip, not to the right.",
      "narration": {
        "prompt": "Where is the bird?"
      },
      "randomise": {
        "shuffleOptions": true
      },
      "position": {
        "object": "bird",
        "relation": "above"
      }
    },
    {
      "id": "turns-1-3",
      "kind": "multiple-choice",
      "prompt": "Watch the car turn. How much does it turn?",
      "options": [
        {
          "id": "a",
          "label": "A quarter turn"
        },
        {
          "id": "b",
          "label": "A half turn"
        },
        {
          "id": "c",
          "label": "A three-quarter turn"
        },
        {
          "id": "d",
          "label": "A whole turn"
        }
      ],
      "correctId": "b",
      "explanation": "A half turn faces the opposite way.",
      "narration": {
        "prompt": "Watch the car turn. How much does it turn?"
      },
      "randomise": {
        "shuffleOptions": true
      },
      "turn": {
        "start": 0,
        "quarters": 2,
        "clockwise": true,
        "showEnd": true
      },
      "hint": "Watch where the headlights point. A half turn faces the opposite way."
    },
    {
      "id": "turns-1-4",
      "kind": "multiple-choice",
      "prompt": "Watch the car turn. How much does it turn?",
      "options": [
        {
          "id": "a",
          "label": "A quarter turn"
        },
        {
          "id": "b",
          "label": "A half turn"
        },
        {
          "id": "c",
          "label": "A three-quarter turn"
        },
        {
          "id": "d",
          "label": "A whole turn"
        }
      ],
      "correctId": "d",
      "explanation": "A whole turn finishes facing the start way.",
      "narration": {
        "prompt": "Watch the car turn. How much does it turn?"
      },
      "randomise": {
        "shuffleOptions": true
      },
      "turn": {
        "start": 2,
        "quarters": 4,
        "clockwise": true,
        "showEnd": true
      },
      "hint": "A whole turn goes all the way round."
    },
    {
      "id": "turns-1-5",
      "kind": "multiple-choice",
      "prompt": "Watch the car turn. How much does it turn?",
      "options": [
        {
          "id": "a",
          "label": "A quarter turn"
        },
        {
          "id": "b",
          "label": "A half turn"
        },
        {
          "id": "c",
          "label": "A three-quarter turn"
        },
        {
          "id": "d",
          "label": "A whole turn"
        }
      ],
      "correctId": "a",
      "explanation": "A quarter turn is one of four equal parts.",
      "narration": {
        "prompt": "Watch the car turn. How much does it turn?"
      },
      "randomise": {
        "shuffleOptions": true
      },
      "turn": {
        "start": 3,
        "quarters": 1,
        "clockwise": true,
        "showEnd": true
      }
    },
    {
      "id": "turns-1-6",
      "kind": "multiple-choice",
      "prompt": "The car makes a half turn this way. Which way does it point now?",
      "options": [
        {
          "id": "a",
          "label": "Up"
        },
        {
          "id": "b",
          "label": "Right"
        },
        {
          "id": "c",
          "label": "Down"
        },
        {
          "id": "d",
          "label": "Left"
        }
      ],
      "correctId": "d",
      "explanation": "A half turn from right faces left, the opposite way.",
      "narration": {
        "prompt": "The car makes a half turn this way. Which way does it point now?"
      },
      "randomise": {
        "shuffleOptions": true
      },
      "turn": {
        "start": 1,
        "quarters": 2,
        "clockwise": true,
        "showEnd": false
      }
    },
    {
      "id": "turns-1-7",
      "kind": "multiple-choice",
      "prompt": "The car makes a quarter turn this way. Which way does it point now?",
      "options": [
        {
          "id": "a",
          "label": "Up"
        },
        {
          "id": "b",
          "label": "Right"
        },
        {
          "id": "c",
          "label": "Down"
        },
        {
          "id": "d",
          "label": "Left"
        }
      ],
      "correctId": "b",
      "explanation": "From up, a quarter turn this way faces right.",
      "narration": {
        "prompt": "The car makes a quarter turn this way. Which way does it point now?"
      },
      "randomise": {
        "shuffleOptions": true
      },
      "turn": {
        "start": 0,
        "quarters": 1,
        "clockwise": true,
        "showEnd": false
      }
    },
    {
      "id": "turns-1-8",
      "kind": "multiple-choice",
      "prompt": "The car makes a whole turn this way. Which way does it point now?",
      "options": [
        {
          "id": "a",
          "label": "Up"
        },
        {
          "id": "b",
          "label": "Right"
        },
        {
          "id": "c",
          "label": "Down"
        },
        {
          "id": "d",
          "label": "Left"
        }
      ],
      "correctId": "d",
      "explanation": "A whole turn finishes the same way it started.",
      "narration": {
        "prompt": "The car makes a whole turn this way. Which way does it point now?"
      },
      "randomise": {
        "shuffleOptions": true
      },
      "turn": {
        "start": 3,
        "quarters": 4,
        "clockwise": true,
        "showEnd": false
      }
    },
    {
      "id": "turns-1-9",
      "kind": "multiple-choice",
      "prompt": "The car makes a half turn this way. Which way does it point now?",
      "options": [
        {
          "id": "a",
          "label": "Up"
        },
        {
          "id": "b",
          "label": "Right"
        },
        {
          "id": "c",
          "label": "Down"
        },
        {
          "id": "d",
          "label": "Left"
        }
      ],
      "correctId": "c",
      "explanation": "A half turn from up faces down, the opposite way.",
      "narration": {
        "prompt": "The car makes a half turn this way. Which way does it point now?"
      },
      "randomise": {
        "shuffleOptions": true
      },
      "turn": {
        "start": 0,
        "quarters": 2,
        "clockwise": true,
        "showEnd": false
      }
    },
    {
      "id": "turns-1-10",
      "kind": "multiple-choice",
      "prompt": "Make the car do a quarter turn this way.",
      "options": [
        {
          "id": "1",
          "label": "A quarter turn"
        },
        {
          "id": "2",
          "label": "A half turn"
        },
        {
          "id": "3",
          "label": "A three-quarter turn"
        },
        {
          "id": "4",
          "label": "A whole turn"
        }
      ],
      "correctId": "1",
      "explanation": "A quarter turn is one step this way, not a half turn.",
      "narration": {
        "prompt": "Make the car do a quarter turn this way."
      },
      "turn": {
        "start": 1,
        "quarters": 1,
        "clockwise": true,
        "showEnd": false,
        "interactive": true
      }
    }
  ]
}
